{
  "id": "corolla-cross",
  "vehicleSlug": "gs4-max",
  "targetType": "competitor",
  "targetSlug": "corolla-cross",
  "displayName": "Toyota Corolla Cross",
  "thumbnailMediaId": "compare-corolla-cross",
  "contentVersion": "2026-06-14",
  "lastVerified": "2026-06-14",
  "dimensions": [
    {
      "category": "Seguridad",
      "rows": [
        {
          "label": "Airbags de serie",
          "anchorValue": "8 airbags",
          "targetValue": "7 airbags (versiones típicas)",
          "verdict": "anchor_wins",
          "personaId": "carlos",
          "explanation": "Ocho airbags de serie en el GS4 MAX — uno de los más completos del segmento. Verificá la versión exacta del Corolla Cross que evaluás."
        },
        {
          "label": "Calificación C-NCAP",
          "anchorValue": "5 estrellas C-NCAP",
          "targetValue": "5 estrellas en pruebas regionales",
          "verdict": "tie",
          "personaId": "carlos",
          "explanation": "Ambos cuentan con respaldo de organismos independientes. La diferencia está en cuánta protección activa y pasiva trae cada uno de serie."
        },
        {
          "label": "Cámara 360°",
          "anchorValue": "Sí, de serie",
          "targetValue": "No en versiones base",
          "verdict": "anchor_wins",
          "personaId": "carlos",
          "explanation": "La cámara panorámica facilita estacionar en calles angostas de Santa Cruz — incluida sin pagar extra en full equipo."
        }
      ]
    },
    {
      "category": "Tecnología",
      "rows": [
        {
          "label": "Pantalla central",
          "anchorValue": "10,1\" táctil",
          "targetValue": "8\"–10\" según versión",
          "verdict": "anchor_wins",
          "personaId": "sofia",
          "explanation": "Pantalla amplia con interfaz ADiGO para navegación y multimedia desde el primer día, sin subir de versión."
        },
        {
          "label": "ADAS de serie",
          "anchorValue": "AEB, ACC, alerta de carril, 360°",
          "targetValue": "Parcial según versión",
          "verdict": "anchor_wins",
          "personaId": "sofia",
          "explanation": "Suite completa de asistencias incluida en la versión full equipo boliviana — no como paquete opcional."
        },
        {
          "label": "Apple CarPlay",
          "anchorValue": "De serie",
          "targetValue": "De serie en versiones equipadas",
          "verdict": "tie",
          "personaId": "sofia",
          "explanation": "Ambos integran smartphone; compará si la versión del competidor que mirás lo incluye sin costo adicional."
        }
      ]
    },
    {
      "category": "Espacio",
      "rows": [
        {
          "label": "Maletero",
          "anchorValue": "638 L (hasta 1.586 L abatido)",
          "targetValue": "~440 L típico",
          "verdict": "anchor_wins",
          "personaId": "carlos",
          "explanation": "Capacidad real para equipaje familiar, compras del súper o viajes interdepartamentales."
        },
        {
          "label": "Distancia entre ejes",
          "anchorValue": "2.750 mm",
          "targetValue": "2.640 mm",
          "verdict": "anchor_wins",
          "personaId": "carlos",
          "explanation": "Más espacio para piernas en asientos traseros — probalo sentándote atrás en el test drive."
        }
      ]
    },
    {
      "category": "Garantía",
      "rows": [
        {
          "label": "Garantía del vehículo",
          "anchorValue": "5 años / 150.000 km",
          "targetValue": "3 años / 100.000 km (típico)",
          "verdict": "anchor_wins",
          "personaId": "carlos",
          "explanation": "Dos años adicionales de respaldo de fábrica — diferencial claro en costo de propiedad a mediano plazo."
        },
        {
          "label": "Mantenimiento sin costo",
          "anchorValue": "3 años / 100.000 km",
          "targetValue": "No incluido de serie",
          "verdict": "anchor_wins",
          "personaId": "carlos",
          "explanation": "Servicios programados cubiertos los primeros tres años en Viaggio — ahorro predecible frente al estándar del segmento."
        }
      ]
    },
    {
      "category": "Mantenimiento",
      "rows": [
        {
          "label": "Servicios programados",
          "anchorValue": "Sin costo 3 años / 100.000 km",
          "targetValue": "Pagás desde el primer servicio",
          "verdict": "anchor_wins",
          "personaId": "carlos",
          "explanation": "Los primeros años de mantenimiento oficial están cubiertos — menos sorpresas en el presupuesto familiar."
        },
        {
          "label": "Red de servicio en Bolivia",
          "anchorValue": "Viaggio · 4 ciudades",
          "targetValue": "Red Toyota consolidada",
          "verdict": "tie",
          "personaId": "carlos",
          "explanation": "Toyota tiene red madura a nivel nacional. Viaggio opera talleres GAC en Santa Cruz, La Paz, El Alto y Cochabamba."
        }
      ]
    },
    {
      "category": "Precio",
      "rows": [
        {
          "label": "Precio lista full equipo (USD)",
          "anchorValue": "Desde $us 42.900",
          "targetValue": "$us 38.000–45.000 según versión",
          "verdict": "tie",
          "personaId": "sofia",
          "explanation": "Depende de la versión equivalente que compares. Sumá equipamiento incluido — no solo precio de lista."
        }
      ]
    },
    {
      "category": "Consumo",
      "rows": [
        {
          "label": "Consumo combinado (WLTC)",
          "anchorValue": "6,8 L/100 km",
          "targetValue": "~6,5–7,0 L/100 km según motor",
          "verdict": "tie",
          "personaId": "carlos",
          "explanation": "Cifras de laboratorio. En tráfico de Santa Cruz el consumo real varía con altitud, carga y estilo de manejo."
        },
        {
          "label": "Consumo real orientativo (ciudad)",
          "anchorValue": "~9–10 km/l en tráfico urbano",
          "targetValue": "Similar según versión",
          "verdict": "tie",
          "personaId": "carlos",
          "explanation": "Estimación orientativa — tu ruta diaria es la prueba definitiva en test drive."
        }
      ]
    },
    {
      "category": "Reventa",
      "rows": [
        {
          "label": "Percepción en mercado de usados",
          "anchorValue": "Marca en posicionamiento · liquidez en construcción",
          "targetValue": "Referencia fuerte · alta demanda usada",
          "verdict": "target_wins",
          "personaId": "carlos",
          "explanation": "Toyota suele retener valor de reventa mejor hoy — no te prometo un porcentaje mágico. Tu mejor defensa: historial de servicio oficial, unidad conservada y garantía vigente."
        }
      ]
    }
  ]
}
